
"https://www.amazon.com/dp/B0C1CVGBMX,,,","Better Than Bouillon Culinary Collection Base, Smoky Chipotle Base, Contains 38 Servings Per Jar, 8-Ounce Glass Jar (Pack of 4)",B0C1CVGBMX,Food E Concepts,888-867-7748,Bougie Freight,608-636-5964,Eternity Essentials,201-375-3757
"https://www.amazon.com/dp/B0DJ4YFL7B,,,","Translation Device, The Latest Instant Translation Device in 2025, Supports Video and Voice Call Translation, 138 Languages, 60 Day Standby, Suitable for iOS and Android (Grey)",B0DJ4YFL7B,AHA Lifestyle,502-779-0773
"https://www.amazon.com/gp/product/B0168MB6II,,,","Gillette ProGlide Shield Razor for Men, Handle + 1 Blade Refill",B0168MB6II,Royal Meds,845-694-6755
"https://www.amazon.com/dp/B084FRD9RW,,,",Cannabis Sativa (Hemp) Seed Oil & Witch Hazel Skin Rescue Cream Cleanser,B084FRD9RW,The FairweatherForge,330-814-2385
"https://www.amazon.com/gp/product/B003O2F0JW,,,","Travel Select Amsterdam Expandable Rolling Upright Luggage, Gray, 2-Piece Set",B003O2F0JW,WILZEE CORP,800-950-5035
"https://www.amazon.com/dp/B0C1CVGBMX,,,","Better Than Bouillon Culinary Collection Base, Smoky Chipotle Base, Contains 38 Servings Per Jar, 8-Ounce Glass Jar (Pack of 4)",B0C1CVGBMX,Food E Concepts,888-867-7748,Bougie Freight,608-636-5964,Eternity Essentials,201-375-3757
"https://www.amazon.com/gp/product/B003O2F0JW,,,","Travel Select Amsterdam Expandable Rolling Upright Luggage, Gray, 2-Piece Set",B003O2F0JW,WILZEE CORP,800-950-5035
"https://www.amazon.com/dp/B0DJ4YFL7B,,,","Translation Device, The Latest Instant Translation Device in 2025, Supports Video and Voice Call Translation, 138 Languages, 60 Day Standby, Suitable for iOS and Android (Grey)",B0DJ4YFL7B,AHA Lifestyle,502-779-0773
"https://www.amazon.com/gp/product/B0168MB6II,,,","Gillette ProGlide Shield Razor for Men, Handle + 1 Blade Refill",B0168MB6II,Royal Meds,845-694-6755
"https://www.amazon.com/dp/B084FRD9RW,,,",Cannabis Sativa (Hemp) Seed Oil & Witch Hazel Skin Rescue Cream Cleanser,B084FRD9RW,The FairweatherForge,330-814-2385
"https://www.amazon.com/DP/B07ZVJMW94?th=1,,,","Monistat 3 Day Yeast Infection Treatment for Women, 3 Miconazole Prefilled Cream Applicators, 2 Pack",B07ZVJMW94,Royal Meds,845-694-6755
"https://www.amazon.com/DP/B0093ABMOQ,,,","Nordic Naturals Nordic Omega-3 Fishies, Tutti Frutti - 36 Fishies - 300 mg Total Omega-3s with EPA & DHA - Healthy Brain, Mood, Vision & Immune System - Non-GMO - 36 Servings",B0093ABMOQ,HOME GOODIES USA LLC,954-224-0940
